{
  "schema_version": 1,
  "contract": "irish_generation_batch",
  "batch_id": "d32.harvest.kilkenny.d32-kilkenny-alice-kyteler.kilkenny-cumhacht-power",
  "created_at": "2026-08-03T21:00:00Z",
  "purpose": "D32 emergency harvest — kilkenny / d32.kilkenny.alice-kyteler / kilkenny.cumhacht.power",
  "voice_profile": {
    "id": "voice.irish-cultural-guide.eleven-v3.v1",
    "revision": 1,
    "provider": "ElevenLabs",
    "voice_name": "Irish Cultural Guide",
    "voice_id": "NPWroowF4phQhaPWjXPj",
    "model_id": "eleven_v3",
    "language_code": "ga",
    "output_format": "mp3_44100_192",
    "voice_settings": {
      "mode": "provider_defaults",
      "overrides": {}
    }
  },
  "execution": {
    "state": "draft",
    "provider_calls_allowed": false,
    "approved_by": null,
    "approved_at": null
  },
  "lines": [
    {
      "line_id": "d32.harvest.kilkenny.d32-kilkenny-alice-kyteler.kilkenny-cumhacht-power.line.d9e9b7a8a1daec5f",
      "member_ids": [
        "d32.kilkenny.09.cumhacht.power.packet-mark"
      ],
      "normalized_text": "Cuimhnigh ar cumhacht i Cill Chainnigh.",
      "text_sha256": "21a34e62a56c2193eb4bf4d54d4a0e8ab2630342f0d394f2941fa64b3f7df7b7",
      "inventory_slug": "cuimhnigh-ar-cumhacht-i-cill-chainnigh",
      "estimated_characters": 39,
      "estimated_credits": 39.0,
      "capture_disposition": "generated_unreviewed",
      "claim": {
        "status": "unclaimed",
        "owner_id": null,
        "claimed_at": null,
        "lease_expires_at": null
      },
      "request": {
        "status": "planned",
        "approved_by": null,
        "approved_at": null
      },
      "retry": {
        "attempt_count": 0,
        "max_attempts": 3,
        "last_attempt_at": null,
        "next_retry_at": null
      },
      "provider_result": {
        "status": "not_started",
        "provider_request_id": null,
        "started_at": null,
        "completed_at": null,
        "reported_credits": null,
        "reported_characters": null
      },
      "error": null,
      "audio": {
        "output_path": "ios/AnTuras/Resources/Audio/cuimhnigh-ar-cumhacht-i-cill-chainnigh.mp3",
        "sha256": null,
        "bytes": null,
        "duration_seconds": null
      },
      "audio_qa": {
        "status": "not_started",
        "record": null
      }
    },
    {
      "line_id": "d32.harvest.kilkenny.d32-kilkenny-alice-kyteler.kilkenny-cumhacht-power.line.fa913b64347dbf17",
      "member_ids": [
        "d32.kilkenny.09.cumhacht.power.packet-place"
      ],
      "normalized_text": "Tá cumhacht i Cill Chainnigh.",
      "text_sha256": "db94f175d98cc7d61b4b0872b189fc80a8bed1d09b830ef85845dc4b6a0e74e3",
      "inventory_slug": "taa-cumhacht-i-cill-chainnigh",
      "estimated_characters": 29,
      "estimated_credits": 29.0,
      "capture_disposition": "generated_unreviewed",
      "claim": {
        "status": "unclaimed",
        "owner_id": null,
        "claimed_at": null,
        "lease_expires_at": null
      },
      "request": {
        "status": "planned",
        "approved_by": null,
        "approved_at": null
      },
      "retry": {
        "attempt_count": 0,
        "max_attempts": 3,
        "last_attempt_at": null,
        "next_retry_at": null
      },
      "provider_result": {
        "status": "not_started",
        "provider_request_id": null,
        "started_at": null,
        "completed_at": null,
        "reported_credits": null,
        "reported_characters": null
      },
      "error": null,
      "audio": {
        "output_path": "ios/AnTuras/Resources/Audio/taa-cumhacht-i-cill-chainnigh.mp3",
        "sha256": null,
        "bytes": null,
        "duration_seconds": null
      },
      "audio_qa": {
        "status": "not_started",
        "record": null
      }
    }
  ],
  "spend": {
    "approved_cap": 25000,
    "estimate_basis": "estimated_credits = Unicode character count × credits_per_character",
    "credits_per_character": 1.0,
    "estimated_batch_credits": 68.0,
    "estimated_cumulative_credits": 14365.0,
    "actual_batch_credits": null,
    "actual_cumulative_credits": null,
    "usage_before": null,
    "usage_after": null
  },
  "counts": {
    "lines": 2,
    "member_references": 2,
    "planned": 2,
    "approved": 0,
    "succeeded": 0,
    "failed": 0
  },
  "manifest_identity_sha256": "47253457a8fb1332600c7a7080477555c4fb0b7e12fcf01d6e36b0526e8f8aa5"
}
