{
  "schema_version": 1,
  "contract": "irish_generation_batch",
  "batch_id": "d32.harvest.carlow.d32-carlow-st-moling.carlow-teach-house",
  "created_at": "2026-08-03T21:00:00Z",
  "purpose": "D32 emergency harvest — carlow / d32.carlow.st-moling / carlow.teach.house",
  "voice_profile": {
    "id": "voice.irish-cultural-guide.eleven-v3.v1",
    "revision": 1,
    "provider": "ElevenLabs",
    "voice_name": "Irish Cultural Guide",
    "voice_id": "NPWroowF4phQhaPWjXPj",
    "model_id": "eleven_v3",
    "language_code": "ga",
    "output_format": "mp3_44100_192",
    "voice_settings": {
      "mode": "provider_defaults",
      "overrides": {}
    }
  },
  "execution": {
    "state": "draft",
    "provider_calls_allowed": false,
    "approved_by": null,
    "approved_at": null
  },
  "lines": [
    {
      "line_id": "d32.harvest.carlow.d32-carlow-st-moling.carlow-teach-house.line.504d112cdd298a6e",
      "member_ids": [
        "d32.carlow.09.teach.house.packet-place"
      ],
      "normalized_text": "Tá teach i Ceatharlach.",
      "text_sha256": "3547fb389376f7d00a1c042d3237b0755a4fbb2200df6894a8bb161f5d7c739d",
      "inventory_slug": "taa-teach-i-ceatharlach",
      "estimated_characters": 23,
      "estimated_credits": 23.0,
      "capture_disposition": "generated_unreviewed",
      "claim": {
        "status": "unclaimed",
        "owner_id": null,
        "claimed_at": null,
        "lease_expires_at": null
      },
      "request": {
        "status": "planned",
        "approved_by": null,
        "approved_at": null
      },
      "retry": {
        "attempt_count": 0,
        "max_attempts": 3,
        "last_attempt_at": null,
        "next_retry_at": null
      },
      "provider_result": {
        "status": "not_started",
        "provider_request_id": null,
        "started_at": null,
        "completed_at": null,
        "reported_credits": null,
        "reported_characters": null
      },
      "error": null,
      "audio": {
        "output_path": "ios/AnTuras/Resources/Audio/taa-teach-i-ceatharlach.mp3",
        "sha256": null,
        "bytes": null,
        "duration_seconds": null
      },
      "audio_qa": {
        "status": "not_started",
        "record": null
      }
    },
    {
      "line_id": "d32.harvest.carlow.d32-carlow-st-moling.carlow-teach-house.line.c7faa3327c9f34d6",
      "member_ids": [
        "d32.carlow.09.teach.house.packet-ask"
      ],
      "normalized_text": "An bhfuil teach i Ceatharlach?",
      "text_sha256": "018361cb61544610d99609d656886d2083d2f55030c9dc01226d14d196cb7f1a",
      "inventory_slug": "an-bhfuil-teach-i-ceatharlach",
      "estimated_characters": 30,
      "estimated_credits": 30.0,
      "capture_disposition": "generated_unreviewed",
      "claim": {
        "status": "unclaimed",
        "owner_id": null,
        "claimed_at": null,
        "lease_expires_at": null
      },
      "request": {
        "status": "planned",
        "approved_by": null,
        "approved_at": null
      },
      "retry": {
        "attempt_count": 0,
        "max_attempts": 3,
        "last_attempt_at": null,
        "next_retry_at": null
      },
      "provider_result": {
        "status": "not_started",
        "provider_request_id": null,
        "started_at": null,
        "completed_at": null,
        "reported_credits": null,
        "reported_characters": null
      },
      "error": null,
      "audio": {
        "output_path": "ios/AnTuras/Resources/Audio/an-bhfuil-teach-i-ceatharlach.mp3",
        "sha256": null,
        "bytes": null,
        "duration_seconds": null
      },
      "audio_qa": {
        "status": "not_started",
        "record": null
      }
    }
  ],
  "spend": {
    "approved_cap": 25000,
    "estimate_basis": "estimated_credits = Unicode character count × credits_per_character",
    "credits_per_character": 1.0,
    "estimated_batch_credits": 53.0,
    "estimated_cumulative_credits": 14350.0,
    "actual_batch_credits": null,
    "actual_cumulative_credits": null,
    "usage_before": null,
    "usage_after": null
  },
  "counts": {
    "lines": 2,
    "member_references": 2,
    "planned": 2,
    "approved": 0,
    "succeeded": 0,
    "failed": 0
  },
  "manifest_identity_sha256": "31044cd7adadce2c2ddbb6906a8e1394e47584e15282046ee4790f274efd141a"
}
