{
  "schema_version": 1,
  "contract": "irish_generation_batch",
  "batch_id": "d32.harvest.carlow.d32-carlow-st-moling.carlow-anseo-here",
  "created_at": "2026-08-03T21:00:00Z",
  "purpose": "D32 emergency harvest — carlow / d32.carlow.st-moling / carlow.anseo.here",
  "voice_profile": {
    "id": "voice.irish-cultural-guide.eleven-v3.v1",
    "revision": 1,
    "provider": "ElevenLabs",
    "voice_name": "Irish Cultural Guide",
    "voice_id": "NPWroowF4phQhaPWjXPj",
    "model_id": "eleven_v3",
    "language_code": "ga",
    "output_format": "mp3_44100_192",
    "voice_settings": {
      "mode": "provider_defaults",
      "overrides": {}
    }
  },
  "execution": {
    "state": "draft",
    "provider_calls_allowed": false,
    "approved_by": null,
    "approved_at": null
  },
  "lines": [
    {
      "line_id": "d32.harvest.carlow.d32-carlow-st-moling.carlow-anseo-here.line.066fbe5822ed12f9",
      "member_ids": [
        "d32.carlow.17.anseo.here.packet-place"
      ],
      "normalized_text": "Tá anseo i Ceatharlach.",
      "text_sha256": "8b7a5e1a760af04c9d3eecb2a106f218e290c9f3cea3833ce39cecf70a8dc7cc",
      "inventory_slug": "taa-anseo-i-ceatharlach",
      "estimated_characters": 23,
      "estimated_credits": 23.0,
      "capture_disposition": "generated_unreviewed",
      "claim": {
        "status": "unclaimed",
        "owner_id": null,
        "claimed_at": null,
        "lease_expires_at": null
      },
      "request": {
        "status": "planned",
        "approved_by": null,
        "approved_at": null
      },
      "retry": {
        "attempt_count": 0,
        "max_attempts": 3,
        "last_attempt_at": null,
        "next_retry_at": null
      },
      "provider_result": {
        "status": "not_started",
        "provider_request_id": null,
        "started_at": null,
        "completed_at": null,
        "reported_credits": null,
        "reported_characters": null
      },
      "error": null,
      "audio": {
        "output_path": "ios/AnTuras/Resources/Audio/taa-anseo-i-ceatharlach.mp3",
        "sha256": null,
        "bytes": null,
        "duration_seconds": null
      },
      "audio_qa": {
        "status": "not_started",
        "record": null
      }
    },
    {
      "line_id": "d32.harvest.carlow.d32-carlow-st-moling.carlow-anseo-here.line.3d39b2bb56ff78b5",
      "member_ids": [
        "d32.carlow.17.anseo.here.packet-ask"
      ],
      "normalized_text": "An bhfuil anseo i Ceatharlach?",
      "text_sha256": "c2b871ce2e01e2a0167cbb78dd5ba17714d3e633ad3654b1d29cc0d3e7f2eade",
      "inventory_slug": "an-bhfuil-anseo-i-ceatharlach",
      "estimated_characters": 30,
      "estimated_credits": 30.0,
      "capture_disposition": "generated_unreviewed",
      "claim": {
        "status": "unclaimed",
        "owner_id": null,
        "claimed_at": null,
        "lease_expires_at": null
      },
      "request": {
        "status": "planned",
        "approved_by": null,
        "approved_at": null
      },
      "retry": {
        "attempt_count": 0,
        "max_attempts": 3,
        "last_attempt_at": null,
        "next_retry_at": null
      },
      "provider_result": {
        "status": "not_started",
        "provider_request_id": null,
        "started_at": null,
        "completed_at": null,
        "reported_credits": null,
        "reported_characters": null
      },
      "error": null,
      "audio": {
        "output_path": "ios/AnTuras/Resources/Audio/an-bhfuil-anseo-i-ceatharlach.mp3",
        "sha256": null,
        "bytes": null,
        "duration_seconds": null
      },
      "audio_qa": {
        "status": "not_started",
        "record": null
      }
    }
  ],
  "spend": {
    "approved_cap": 25000,
    "estimate_basis": "estimated_credits = Unicode character count × credits_per_character",
    "credits_per_character": 1.0,
    "estimated_batch_credits": 53.0,
    "estimated_cumulative_credits": 14350.0,
    "actual_batch_credits": null,
    "actual_cumulative_credits": null,
    "usage_before": null,
    "usage_after": null
  },
  "counts": {
    "lines": 2,
    "member_references": 2,
    "planned": 2,
    "approved": 0,
    "succeeded": 0,
    "failed": 0
  },
  "manifest_identity_sha256": "04847c4cc27452394e4f0e6cdea14144d66d5219c032e4a50b0b19566a64fe81"
}
