{
  "schema_version": 1,
  "contract": "irish_generation_batch",
  "batch_id": "d32.harvest.antrim.d32-antrim-fionn-mac-cumhaill.antrim-thainig-came",
  "created_at": "2026-08-03T21:00:00Z",
  "purpose": "D32 emergency harvest — antrim / d32.antrim.fionn-mac-cumhaill / antrim.thainig.came",
  "voice_profile": {
    "id": "voice.irish-cultural-guide.eleven-v3.v1",
    "revision": 1,
    "provider": "ElevenLabs",
    "voice_name": "Irish Cultural Guide",
    "voice_id": "NPWroowF4phQhaPWjXPj",
    "model_id": "eleven_v3",
    "language_code": "ga",
    "output_format": "mp3_44100_192",
    "voice_settings": {
      "mode": "provider_defaults",
      "overrides": {}
    }
  },
  "execution": {
    "state": "draft",
    "provider_calls_allowed": false,
    "approved_by": null,
    "approved_at": null
  },
  "lines": [
    {
      "line_id": "d32.harvest.antrim.d32-antrim-fionn-mac-cumhaill.antrim-thainig-came.line.46db8adad436894a",
      "member_ids": [
        "d32.antrim.17.thainig.came.packet-place"
      ],
      "normalized_text": "Tá tháinig i Aontroim.",
      "text_sha256": "758148265f27306e374099049e21b6246750937830df358f39462344cadab088",
      "inventory_slug": "taa-thaainig-i-aontroim",
      "estimated_characters": 22,
      "estimated_credits": 22.0,
      "capture_disposition": "generated_unreviewed",
      "claim": {
        "status": "unclaimed",
        "owner_id": null,
        "claimed_at": null,
        "lease_expires_at": null
      },
      "request": {
        "status": "planned",
        "approved_by": null,
        "approved_at": null
      },
      "retry": {
        "attempt_count": 0,
        "max_attempts": 3,
        "last_attempt_at": null,
        "next_retry_at": null
      },
      "provider_result": {
        "status": "not_started",
        "provider_request_id": null,
        "started_at": null,
        "completed_at": null,
        "reported_credits": null,
        "reported_characters": null
      },
      "error": null,
      "audio": {
        "output_path": "ios/AnTuras/Resources/Audio/taa-thaainig-i-aontroim.mp3",
        "sha256": null,
        "bytes": null,
        "duration_seconds": null
      },
      "audio_qa": {
        "status": "not_started",
        "record": null
      }
    },
    {
      "line_id": "d32.harvest.antrim.d32-antrim-fionn-mac-cumhaill.antrim-thainig-came.line.7b2874196af3a89a",
      "member_ids": [
        "d32.antrim.17.thainig.came.packet-ask"
      ],
      "normalized_text": "An bhfuil tháinig i Aontroim?",
      "text_sha256": "dc5c6265a3e55eed0b551fac675e49f00f7c44157db6d30967ec6810e220974f",
      "inventory_slug": "an-bhfuil-thaainig-i-aontroim",
      "estimated_characters": 29,
      "estimated_credits": 29.0,
      "capture_disposition": "generated_unreviewed",
      "claim": {
        "status": "unclaimed",
        "owner_id": null,
        "claimed_at": null,
        "lease_expires_at": null
      },
      "request": {
        "status": "planned",
        "approved_by": null,
        "approved_at": null
      },
      "retry": {
        "attempt_count": 0,
        "max_attempts": 3,
        "last_attempt_at": null,
        "next_retry_at": null
      },
      "provider_result": {
        "status": "not_started",
        "provider_request_id": null,
        "started_at": null,
        "completed_at": null,
        "reported_credits": null,
        "reported_characters": null
      },
      "error": null,
      "audio": {
        "output_path": "ios/AnTuras/Resources/Audio/an-bhfuil-thaainig-i-aontroim.mp3",
        "sha256": null,
        "bytes": null,
        "duration_seconds": null
      },
      "audio_qa": {
        "status": "not_started",
        "record": null
      }
    }
  ],
  "spend": {
    "approved_cap": 25000,
    "estimate_basis": "estimated_credits = Unicode character count × credits_per_character",
    "credits_per_character": 1.0,
    "estimated_batch_credits": 51.0,
    "estimated_cumulative_credits": 14348.0,
    "actual_batch_credits": null,
    "actual_cumulative_credits": null,
    "usage_before": null,
    "usage_after": null
  },
  "counts": {
    "lines": 2,
    "member_references": 2,
    "planned": 2,
    "approved": 0,
    "succeeded": 0,
    "failed": 0
  },
  "manifest_identity_sha256": "0bf5795b8c6d4b949612cfc0c6ea336655eeeba4dc3a22234b5632706102c1ab"
}
