{
  "schema_version": 1,
  "contract": "irish_generation_batch",
  "batch_id": "d32.harvest.clare.d32-clare-brian-boru-kincora.clare-teigh-go",
  "created_at": "2026-08-03T21:00:00Z",
  "purpose": "D32 emergency harvest — clare / d32.clare.brian-boru-kincora / clare.teigh.go",
  "voice_profile": {
    "id": "voice.irish-cultural-guide.eleven-v3.v1",
    "revision": 1,
    "provider": "ElevenLabs",
    "voice_name": "Irish Cultural Guide",
    "voice_id": "NPWroowF4phQhaPWjXPj",
    "model_id": "eleven_v3",
    "language_code": "ga",
    "output_format": "mp3_44100_192",
    "voice_settings": {
      "mode": "provider_defaults",
      "overrides": {}
    }
  },
  "execution": {
    "state": "draft",
    "provider_calls_allowed": false,
    "approved_by": null,
    "approved_at": null
  },
  "lines": [
    {
      "line_id": "d32.harvest.clare.d32-clare-brian-boru-kincora.clare-teigh-go.line.00f017b5710b9e3f",
      "member_ids": [
        "d32.clare.11.teigh.go.packet-ask"
      ],
      "normalized_text": "An bhfuil téigh i an Clár?",
      "text_sha256": "5cb781576d4b4af8fdf48c01b5a427ff15e714c113d574d3fa8dbee1744df4a4",
      "inventory_slug": "an-bhfuil-teeigh-i-an-claar",
      "estimated_characters": 26,
      "estimated_credits": 26.0,
      "capture_disposition": "generated_unreviewed",
      "claim": {
        "status": "unclaimed",
        "owner_id": null,
        "claimed_at": null,
        "lease_expires_at": null
      },
      "request": {
        "status": "planned",
        "approved_by": null,
        "approved_at": null
      },
      "retry": {
        "attempt_count": 0,
        "max_attempts": 3,
        "last_attempt_at": null,
        "next_retry_at": null
      },
      "provider_result": {
        "status": "not_started",
        "provider_request_id": null,
        "started_at": null,
        "completed_at": null,
        "reported_credits": null,
        "reported_characters": null
      },
      "error": null,
      "audio": {
        "output_path": "ios/AnTuras/Resources/Audio/an-bhfuil-teeigh-i-an-claar.mp3",
        "sha256": null,
        "bytes": null,
        "duration_seconds": null
      },
      "audio_qa": {
        "status": "not_started",
        "record": null
      }
    },
    {
      "line_id": "d32.harvest.clare.d32-clare-brian-boru-kincora.clare-teigh-go.line.680f6d9cab170601",
      "member_ids": [
        "d32.clare.11.teigh.go.packet-place"
      ],
      "normalized_text": "Tá téigh i an Clár.",
      "text_sha256": "8bd6389d30ee3d158865b1f83ef761bea89b032e43e46c2f324df5d242abbe33",
      "inventory_slug": "taa-teeigh-i-an-claar",
      "estimated_characters": 19,
      "estimated_credits": 19.0,
      "capture_disposition": "generated_unreviewed",
      "claim": {
        "status": "unclaimed",
        "owner_id": null,
        "claimed_at": null,
        "lease_expires_at": null
      },
      "request": {
        "status": "planned",
        "approved_by": null,
        "approved_at": null
      },
      "retry": {
        "attempt_count": 0,
        "max_attempts": 3,
        "last_attempt_at": null,
        "next_retry_at": null
      },
      "provider_result": {
        "status": "not_started",
        "provider_request_id": null,
        "started_at": null,
        "completed_at": null,
        "reported_credits": null,
        "reported_characters": null
      },
      "error": null,
      "audio": {
        "output_path": "ios/AnTuras/Resources/Audio/taa-teeigh-i-an-claar.mp3",
        "sha256": null,
        "bytes": null,
        "duration_seconds": null
      },
      "audio_qa": {
        "status": "not_started",
        "record": null
      }
    }
  ],
  "spend": {
    "approved_cap": 25000,
    "estimate_basis": "estimated_credits = Unicode character count × credits_per_character",
    "credits_per_character": 1.0,
    "estimated_batch_credits": 45.0,
    "estimated_cumulative_credits": 14342.0,
    "actual_batch_credits": null,
    "actual_cumulative_credits": null,
    "usage_before": null,
    "usage_after": null
  },
  "counts": {
    "lines": 2,
    "member_references": 2,
    "planned": 2,
    "approved": 0,
    "succeeded": 0,
    "failed": 0
  },
  "manifest_identity_sha256": "7257525b7e00858dda3c0fe836a57bf5f3d2e93a7f539cc32ff1034b9aafd462"
}
