{
  "schema_version": 1,
  "contract": "irish_generation_batch",
  "batch_id": "d32.harvest.clare.d32-clare-brian-boru-kincora.clare-fianaise-evidence",
  "created_at": "2026-08-03T21:00:00Z",
  "purpose": "D32 emergency harvest — clare / d32.clare.brian-boru-kincora / clare.fianaise.evidence",
  "voice_profile": {
    "id": "voice.irish-cultural-guide.eleven-v3.v1",
    "revision": 1,
    "provider": "ElevenLabs",
    "voice_name": "Irish Cultural Guide",
    "voice_id": "NPWroowF4phQhaPWjXPj",
    "model_id": "eleven_v3",
    "language_code": "ga",
    "output_format": "mp3_44100_192",
    "voice_settings": {
      "mode": "provider_defaults",
      "overrides": {}
    }
  },
  "execution": {
    "state": "draft",
    "provider_calls_allowed": false,
    "approved_by": null,
    "approved_at": null
  },
  "lines": [
    {
      "line_id": "d32.harvest.clare.d32-clare-brian-boru-kincora.clare-fianaise-evidence.line.89453116cac392ee",
      "member_ids": [
        "d32.clare.10.fianaise.evidence.packet-ask"
      ],
      "normalized_text": "An bhfuil fianaise i an Clár?",
      "text_sha256": "84e1d256f08666a4ac49e0d06796e1165cfbb840e60645fb247b63a4d4098888",
      "inventory_slug": "an-bhfuil-fianaise-i-an-claar",
      "estimated_characters": 29,
      "estimated_credits": 29.0,
      "capture_disposition": "generated_unreviewed",
      "claim": {
        "status": "unclaimed",
        "owner_id": null,
        "claimed_at": null,
        "lease_expires_at": null
      },
      "request": {
        "status": "planned",
        "approved_by": null,
        "approved_at": null
      },
      "retry": {
        "attempt_count": 0,
        "max_attempts": 3,
        "last_attempt_at": null,
        "next_retry_at": null
      },
      "provider_result": {
        "status": "not_started",
        "provider_request_id": null,
        "started_at": null,
        "completed_at": null,
        "reported_credits": null,
        "reported_characters": null
      },
      "error": null,
      "audio": {
        "output_path": "ios/AnTuras/Resources/Audio/an-bhfuil-fianaise-i-an-claar.mp3",
        "sha256": null,
        "bytes": null,
        "duration_seconds": null
      },
      "audio_qa": {
        "status": "not_started",
        "record": null
      }
    },
    {
      "line_id": "d32.harvest.clare.d32-clare-brian-boru-kincora.clare-fianaise-evidence.line.8c5cd834bb46bbfc",
      "member_ids": [
        "d32.clare.10.fianaise.evidence.packet-place"
      ],
      "normalized_text": "Tá fianaise i an Clár.",
      "text_sha256": "93b2ee94915dabe44b1a92448c5d9e946f0bfd04901201f89f5653b40fa9e364",
      "inventory_slug": "taa-fianaise-i-an-claar",
      "estimated_characters": 22,
      "estimated_credits": 22.0,
      "capture_disposition": "generated_unreviewed",
      "claim": {
        "status": "unclaimed",
        "owner_id": null,
        "claimed_at": null,
        "lease_expires_at": null
      },
      "request": {
        "status": "planned",
        "approved_by": null,
        "approved_at": null
      },
      "retry": {
        "attempt_count": 0,
        "max_attempts": 3,
        "last_attempt_at": null,
        "next_retry_at": null
      },
      "provider_result": {
        "status": "not_started",
        "provider_request_id": null,
        "started_at": null,
        "completed_at": null,
        "reported_credits": null,
        "reported_characters": null
      },
      "error": null,
      "audio": {
        "output_path": "ios/AnTuras/Resources/Audio/taa-fianaise-i-an-claar.mp3",
        "sha256": null,
        "bytes": null,
        "duration_seconds": null
      },
      "audio_qa": {
        "status": "not_started",
        "record": null
      }
    }
  ],
  "spend": {
    "approved_cap": 25000,
    "estimate_basis": "estimated_credits = Unicode character count × credits_per_character",
    "credits_per_character": 1.0,
    "estimated_batch_credits": 51.0,
    "estimated_cumulative_credits": 14348.0,
    "actual_batch_credits": null,
    "actual_cumulative_credits": null,
    "usage_before": null,
    "usage_after": null
  },
  "counts": {
    "lines": 2,
    "member_references": 2,
    "planned": 2,
    "approved": 0,
    "succeeded": 0,
    "failed": 0
  },
  "manifest_identity_sha256": "97b81567ee07e1a8114661c1244a15b74e99755089f2b05ff4789f288b228150"
}
