{
  "schema_version": 1,
  "contract": "irish_generation_batch",
  "batch_id": "d32.harvest.longford.d32-longford-corlea-trackway.longford-tog-build",
  "created_at": "2026-08-03T21:00:00Z",
  "purpose": "D32 emergency harvest — longford / d32.longford.corlea-trackway / longford.tog.build",
  "voice_profile": {
    "id": "voice.irish-cultural-guide.eleven-v3.v1",
    "revision": 1,
    "provider": "ElevenLabs",
    "voice_name": "Irish Cultural Guide",
    "voice_id": "NPWroowF4phQhaPWjXPj",
    "model_id": "eleven_v3",
    "language_code": "ga",
    "output_format": "mp3_44100_192",
    "voice_settings": {
      "mode": "provider_defaults",
      "overrides": {}
    }
  },
  "execution": {
    "state": "draft",
    "provider_calls_allowed": false,
    "approved_by": null,
    "approved_at": null
  },
  "lines": [
    {
      "line_id": "d32.harvest.longford.d32-longford-corlea-trackway.longford-tog-build.line.359125174de5dbe2",
      "member_ids": [
        "d32.longford.11.tog.build.notice"
      ],
      "normalized_text": "Tógadh bóthar adhmaid; tá tóg ann.",
      "text_sha256": "de3bde20f432487290c0efa358feb2dc921a70abab869dfb7aed896821706534",
      "inventory_slug": "toogadh-boothar-adhmaid-taa-toog-ann",
      "estimated_characters": 34,
      "estimated_credits": 34.0,
      "capture_disposition": "generated_unreviewed",
      "claim": {
        "status": "unclaimed",
        "owner_id": null,
        "claimed_at": null,
        "lease_expires_at": null
      },
      "request": {
        "status": "planned",
        "approved_by": null,
        "approved_at": null
      },
      "retry": {
        "attempt_count": 0,
        "max_attempts": 3,
        "last_attempt_at": null,
        "next_retry_at": null
      },
      "provider_result": {
        "status": "not_started",
        "provider_request_id": null,
        "started_at": null,
        "completed_at": null,
        "reported_credits": null,
        "reported_characters": null
      },
      "error": null,
      "audio": {
        "output_path": "ios/AnTuras/Resources/Audio/toogadh-boothar-adhmaid-taa-toog-ann.mp3",
        "sha256": null,
        "bytes": null,
        "duration_seconds": null
      },
      "audio_qa": {
        "status": "not_started",
        "record": null
      }
    },
    {
      "line_id": "d32.harvest.longford.d32-longford-corlea-trackway.longford-tog-build.line.4a0fa59ec4c42f8e",
      "member_ids": [
        "d32.longford.11.tog.build.evidence"
      ],
      "normalized_text": "Féach ar an tóg ag Corr Liath.",
      "text_sha256": "ee19aeaf717f9341f548600a5ba949ce1132d32ccd4541d95309de665d794aa9",
      "inventory_slug": "feeach-ar-an-toog-ag-corr-liath",
      "estimated_characters": 30,
      "estimated_credits": 30.0,
      "capture_disposition": "generated_unreviewed",
      "claim": {
        "status": "unclaimed",
        "owner_id": null,
        "claimed_at": null,
        "lease_expires_at": null
      },
      "request": {
        "status": "planned",
        "approved_by": null,
        "approved_at": null
      },
      "retry": {
        "attempt_count": 0,
        "max_attempts": 3,
        "last_attempt_at": null,
        "next_retry_at": null
      },
      "provider_result": {
        "status": "not_started",
        "provider_request_id": null,
        "started_at": null,
        "completed_at": null,
        "reported_credits": null,
        "reported_characters": null
      },
      "error": null,
      "audio": {
        "output_path": "ios/AnTuras/Resources/Audio/feeach-ar-an-toog-ag-corr-liath.mp3",
        "sha256": null,
        "bytes": null,
        "duration_seconds": null
      },
      "audio_qa": {
        "status": "not_started",
        "record": null
      }
    },
    {
      "line_id": "d32.harvest.longford.d32-longford-corlea-trackway.longford-tog-build.line.4c76508ccb2c7de4",
      "member_ids": [
        "d32.longford.11.tog.build.pattern"
      ],
      "normalized_text": "Téann an tóg trasna an phortaigh.",
      "text_sha256": "8d59e942255f5e36b050dc7f0e01e81f44188e368a57c41ee9e2d5bff92b5699",
      "inventory_slug": "teeann-an-toog-trasna-an-phortaigh",
      "estimated_characters": 33,
      "estimated_credits": 33.0,
      "capture_disposition": "generated_unreviewed",
      "claim": {
        "status": "unclaimed",
        "owner_id": null,
        "claimed_at": null,
        "lease_expires_at": null
      },
      "request": {
        "status": "planned",
        "approved_by": null,
        "approved_at": null
      },
      "retry": {
        "attempt_count": 0,
        "max_attempts": 3,
        "last_attempt_at": null,
        "next_retry_at": null
      },
      "provider_result": {
        "status": "not_started",
        "provider_request_id": null,
        "started_at": null,
        "completed_at": null,
        "reported_credits": null,
        "reported_characters": null
      },
      "error": null,
      "audio": {
        "output_path": "ios/AnTuras/Resources/Audio/teeann-an-toog-trasna-an-phortaigh.mp3",
        "sha256": null,
        "bytes": null,
        "duration_seconds": null
      },
      "audio_qa": {
        "status": "not_started",
        "record": null
      }
    }
  ],
  "spend": {
    "approved_cap": 25000,
    "estimate_basis": "estimated_credits = Unicode character count × credits_per_character",
    "credits_per_character": 1.0,
    "estimated_batch_credits": 97.0,
    "estimated_cumulative_credits": 14394.0,
    "actual_batch_credits": null,
    "actual_cumulative_credits": null,
    "usage_before": null,
    "usage_after": null
  },
  "counts": {
    "lines": 3,
    "member_references": 3,
    "planned": 3,
    "approved": 0,
    "succeeded": 0,
    "failed": 0
  },
  "manifest_identity_sha256": "a03e62dfb8efc988ee27827c3da826fea6f49504937ae95e144939b52d92fadf"
}
