{
  "schema_version": 1,
  "contract": "irish_generation_batch",
  "batch_id": "d32.harvest.down.d32-down-patrick-saul.down-nua-new",
  "created_at": "2026-08-03T21:00:00Z",
  "purpose": "D32 emergency harvest — down / d32.down.patrick-saul / down.nua.new",
  "voice_profile": {
    "id": "voice.irish-cultural-guide.eleven-v3.v1",
    "revision": 1,
    "provider": "ElevenLabs",
    "voice_name": "Irish Cultural Guide",
    "voice_id": "NPWroowF4phQhaPWjXPj",
    "model_id": "eleven_v3",
    "language_code": "ga",
    "output_format": "mp3_44100_192",
    "voice_settings": {
      "mode": "provider_defaults",
      "overrides": {}
    }
  },
  "execution": {
    "state": "draft",
    "provider_calls_allowed": false,
    "approved_by": null,
    "approved_at": null
  },
  "lines": [
    {
      "line_id": "d32.harvest.down.d32-down-patrick-saul.down-nua-new.line.aa86d9b05d4ef8a1",
      "member_ids": [
        "d32.down.20.nua.new.packet-place"
      ],
      "normalized_text": "Tá nua i an Dún.",
      "text_sha256": "06df9c84a3fec8741fe99a08aedcb1ef6c4de2045f5fbf7d959e307d70a56dff",
      "inventory_slug": "taa-nua-i-an-duun",
      "estimated_characters": 16,
      "estimated_credits": 16.0,
      "capture_disposition": "generated_unreviewed",
      "claim": {
        "status": "unclaimed",
        "owner_id": null,
        "claimed_at": null,
        "lease_expires_at": null
      },
      "request": {
        "status": "planned",
        "approved_by": null,
        "approved_at": null
      },
      "retry": {
        "attempt_count": 0,
        "max_attempts": 3,
        "last_attempt_at": null,
        "next_retry_at": null
      },
      "provider_result": {
        "status": "not_started",
        "provider_request_id": null,
        "started_at": null,
        "completed_at": null,
        "reported_credits": null,
        "reported_characters": null
      },
      "error": null,
      "audio": {
        "output_path": "ios/AnTuras/Resources/Audio/taa-nua-i-an-duun.mp3",
        "sha256": null,
        "bytes": null,
        "duration_seconds": null
      },
      "audio_qa": {
        "status": "not_started",
        "record": null
      }
    },
    {
      "line_id": "d32.harvest.down.d32-down-patrick-saul.down-nua-new.line.fd0822bacd25b5fa",
      "member_ids": [
        "d32.down.20.nua.new.packet-ask"
      ],
      "normalized_text": "An bhfuil nua i an Dún?",
      "text_sha256": "d85ce484cc659e19f0e8c7f5e4ad4fb79a5e575b5206646b0900a063398109b6",
      "inventory_slug": "an-bhfuil-nua-i-an-duun",
      "estimated_characters": 23,
      "estimated_credits": 23.0,
      "capture_disposition": "generated_unreviewed",
      "claim": {
        "status": "unclaimed",
        "owner_id": null,
        "claimed_at": null,
        "lease_expires_at": null
      },
      "request": {
        "status": "planned",
        "approved_by": null,
        "approved_at": null
      },
      "retry": {
        "attempt_count": 0,
        "max_attempts": 3,
        "last_attempt_at": null,
        "next_retry_at": null
      },
      "provider_result": {
        "status": "not_started",
        "provider_request_id": null,
        "started_at": null,
        "completed_at": null,
        "reported_credits": null,
        "reported_characters": null
      },
      "error": null,
      "audio": {
        "output_path": "ios/AnTuras/Resources/Audio/an-bhfuil-nua-i-an-duun.mp3",
        "sha256": null,
        "bytes": null,
        "duration_seconds": null
      },
      "audio_qa": {
        "status": "not_started",
        "record": null
      }
    }
  ],
  "spend": {
    "approved_cap": 25000,
    "estimate_basis": "estimated_credits = Unicode character count × credits_per_character",
    "credits_per_character": 1.0,
    "estimated_batch_credits": 39.0,
    "estimated_cumulative_credits": 14336.0,
    "actual_batch_credits": null,
    "actual_cumulative_credits": null,
    "usage_before": null,
    "usage_after": null
  },
  "counts": {
    "lines": 2,
    "member_references": 2,
    "planned": 2,
    "approved": 0,
    "succeeded": 0,
    "failed": 0
  },
  "manifest_identity_sha256": "5b539f0ecb5c0655edbabcf9776d3a2f11438742ecfe8920bac89268bfc05239"
}
