{
  "schema_version": 1,
  "contract": "irish_generation_batch",
  "batch_id": "d32.harvest.kildare.d32-kildare-brigid-fire.kildare-cinealta-kind",
  "created_at": "2026-08-03T21:00:00Z",
  "purpose": "D32 emergency harvest — kildare / d32.kildare.brigid-fire / kildare.cinealta.kind",
  "voice_profile": {
    "id": "voice.irish-cultural-guide.eleven-v3.v1",
    "revision": 1,
    "provider": "ElevenLabs",
    "voice_name": "Irish Cultural Guide",
    "voice_id": "NPWroowF4phQhaPWjXPj",
    "model_id": "eleven_v3",
    "language_code": "ga",
    "output_format": "mp3_44100_192",
    "voice_settings": {
      "mode": "provider_defaults",
      "overrides": {}
    }
  },
  "execution": {
    "state": "draft",
    "provider_calls_allowed": false,
    "approved_by": null,
    "approved_at": null
  },
  "lines": [
    {
      "line_id": "d32.harvest.kildare.d32-kildare-brigid-fire.kildare-cinealta-kind.line.722b3d55b1eadda3",
      "member_ids": [
        "d32.kildare.05.cinealta.kind.packet-place"
      ],
      "normalized_text": "Tá cineálta i Cill Dara.",
      "text_sha256": "3171a6ff12e3154e3ec68c5f53065cd07d118c57c380fb479f624b92aa069e8b",
      "inventory_slug": "taa-cineaalta-i-cill-dara",
      "estimated_characters": 24,
      "estimated_credits": 24.0,
      "capture_disposition": "generated_unreviewed",
      "claim": {
        "status": "unclaimed",
        "owner_id": null,
        "claimed_at": null,
        "lease_expires_at": null
      },
      "request": {
        "status": "planned",
        "approved_by": null,
        "approved_at": null
      },
      "retry": {
        "attempt_count": 0,
        "max_attempts": 3,
        "last_attempt_at": null,
        "next_retry_at": null
      },
      "provider_result": {
        "status": "not_started",
        "provider_request_id": null,
        "started_at": null,
        "completed_at": null,
        "reported_credits": null,
        "reported_characters": null
      },
      "error": null,
      "audio": {
        "output_path": "ios/AnTuras/Resources/Audio/taa-cineaalta-i-cill-dara.mp3",
        "sha256": null,
        "bytes": null,
        "duration_seconds": null
      },
      "audio_qa": {
        "status": "not_started",
        "record": null
      }
    },
    {
      "line_id": "d32.harvest.kildare.d32-kildare-brigid-fire.kildare-cinealta-kind.line.8bae10d5776fd98a",
      "member_ids": [
        "d32.kildare.05.cinealta.kind.packet-ask"
      ],
      "normalized_text": "An bhfuil cineálta i Cill Dara?",
      "text_sha256": "37162d41585c0a9098471426de392429773f2ef6a25a9e55372c5d355a8bd410",
      "inventory_slug": "an-bhfuil-cineaalta-i-cill-dara",
      "estimated_characters": 31,
      "estimated_credits": 31.0,
      "capture_disposition": "generated_unreviewed",
      "claim": {
        "status": "unclaimed",
        "owner_id": null,
        "claimed_at": null,
        "lease_expires_at": null
      },
      "request": {
        "status": "planned",
        "approved_by": null,
        "approved_at": null
      },
      "retry": {
        "attempt_count": 0,
        "max_attempts": 3,
        "last_attempt_at": null,
        "next_retry_at": null
      },
      "provider_result": {
        "status": "not_started",
        "provider_request_id": null,
        "started_at": null,
        "completed_at": null,
        "reported_credits": null,
        "reported_characters": null
      },
      "error": null,
      "audio": {
        "output_path": "ios/AnTuras/Resources/Audio/an-bhfuil-cineaalta-i-cill-dara.mp3",
        "sha256": null,
        "bytes": null,
        "duration_seconds": null
      },
      "audio_qa": {
        "status": "not_started",
        "record": null
      }
    }
  ],
  "spend": {
    "approved_cap": 25000,
    "estimate_basis": "estimated_credits = Unicode character count × credits_per_character",
    "credits_per_character": 1.0,
    "estimated_batch_credits": 55.0,
    "estimated_cumulative_credits": 14352.0,
    "actual_batch_credits": null,
    "actual_cumulative_credits": null,
    "usage_before": null,
    "usage_after": null
  },
  "counts": {
    "lines": 2,
    "member_references": 2,
    "planned": 2,
    "approved": 0,
    "succeeded": 0,
    "failed": 0
  },
  "manifest_identity_sha256": "7fd1b1635161f9be5afb1c5b7a4e779de645a6fcb7086236d976db63a4de3750"
}
